<?xml version="1.0" encoding="UTF-8"?>
<creature xmlns:xsi="http://www.w3.org/2001/XMLSchema-instance"
    xsi:noNamespaceSchemaLocation="file:/home/tom/Opendungeons/opendungeons/xsd/CreatureSchema.xsd">
    <name>Dragon_001</name>
    <HP>200 </HP>
    <mana>25 </mana>
    <posX>-41</posX>
    <posY>-92</posY>
    <posZ>0</posZ>
    <color>1</color>
    <weaponLname>
        <name>none</name>
        <damage>10</damage>
        <range>4</range>
        <defense>UniqueUniconr18</defense>
        
    </weaponLname>
    <weaponRname>
        <name>none</name>
        <damage>8</damage>
        <range>3</range>
        <defense>0</defense>
            
     </weaponRname>        
        
        
</creature>
