<?xml version="1.0" encoding="UTF-8"?>
<creature xmlns:xsi="http://www.w3.org/2001/XMLSchema-instance"
    xsi:noNamespaceSchemaLocation="file:/home/tom/Opendungeons/opendungeons/xsd/CreatureSchema.xsd">
    <class>Knight</class>
    <name>Knight_003</name>
    <HP>155 </HP>
    <mana>2 </mana>
    <posX>-16</posX>
    <posY>1</posY>
    <posZ>0</posZ>
    <color>1</color>
    <weaponLname>
        <name>Shield_small</name>
        <damage>14</damage>
        <range>4</range>
        <defense>0</defense>
        
    </weaponLname>
    <weaponRname>
        <name>Longsword</name>
        <damage>14</damage>
        <range>3</range>
        <defense>0</defense>
            
     </weaponRname>        
        
        
</creature>
