<?xml version="1.0" encoding="UTF-8"?>
<creature xmlns:xsi="http://www.w3.org/2001/XMLSchema-instance"
    xsi:noNamespaceSchemaLocation="file:/home/tom/Opendungeons/opendungeons/xsd/CreatureSchema.xsd">
    <name>Dwarf1_001</name>
    <HP>145 </HP>
    <mana>7 </mana>
    <posX>7</posX>
    <posY>-7</posY>
    <posZ>0</posZ>
    <color>2</color>
    <weaponLname>
        <name>Roundshield</name>
        <damage>0</damage>
        <range>0</range>
        <defense>UniqueUniconr18</defense>
        
    </weaponLname>
    <weaponRname>
        <name>Sabre</name>
        <damage>10</damage>
        <range>3</range>
        <defense>0</defense>
            
     </weaponRname>        
        
        
</creature>
