<?xml version="1.0" encoding="UTF-8"?>
<creature xmlns:xsi="http://www.w3.org/2001/XMLSchema-instance"
    xsi:noNamespaceSchemaLocation="file:/home/tom/Opendungeons/opendungeons/xsd/CreatureSchema.xsd">
    <class>Dwarf2</class>
    <name>Dwarf2_002</name>
    <HP>145 </HP>
    <mana>7 </mana>
    <posX>2</posX>
    <posY>-9</posY>
    <posZ>0</posZ>
    <color>2</color>
    <weaponLname>
        <name>none</name>
        <damage>6</damage>
        <range>4</range>
        <defense>0</defense>
        
    </weaponLname>
    <weaponRname>
        <name>Longsword</name>
        <damage>14</damage>
        <range>4</range>
        <defense>0</defense>
            
     </weaponRname>        
        
        
</creature>
