<?xml version="1.0" encoding="UTF-8"?>
<creature xmlns:xsi="http://www.w3.org/2001/XMLSchema-instance"
    xsi:noNamespaceSchemaLocation="file:/home/tom/Opendungeons/opendungeons/xsd/CreatureSchema.xsd">
    <name>Wizard7</name>
    <HP>125 </HP>
    <mana>3 </mana>
    <posX>-10</posX>
    <posY>28</posY>
    <posZ>0</posZ>
    <color>2</color>
    <weaponLname>
        <name>Staff</name>
        <damage>7</damage>
        <range>10</range>
        <defense>3</defense>
        
    </weaponLname>
    <weaponRname>
        <name>none</name>
        <damage>1</damage>
        <range>4</range>
        <defense>0</defense>
            
     </weaponRname>        
        
        
</creature>
